Date,Top Performers,Bottom Performers
2010-03,"NUE, RHI, CMI, VMC, APD, CINF, HOLX, BRO, PPG, EMN, IEX, ED, FRT, AEE, MHK, ATO, ROK, EIX, ESS, ROP, INCY, DOV, NTRS, PNW, SNA","LNC, DTE, TTWO, ROL, FE, DHI, CMS, BAX, AOS, AVY, GL, POOL, HBAN, TER, FDS, BXP, AFL, SJM, JBHT, STT, SWK, COO, ADM, MAA, CHD"
2010-04,"TTWO, TER, DTE, POOL, SWK, AVY, ROK, PPG, FRT, MAA, EMN, ROP, BXP, CMS, APD, ATO, CHD, HBAN, VMC, JBHT, FDS, ESS, MHK, CMI, DHI","BRO, DOV, SNA, EIX, IEX, ED, SJM, AEE, NUE, GL, ROL, COO, AFL, STT, HOLX, INCY, ADM, FE, BAX, RHI, AOS, PNW, LNC, CINF, NTRS"
2010-05,"TTWO, MAA, EMN, CMS, SJM, ADM, FDS, AOS, PPG, HBAN, IEX, ATO, SNA, RHI, NTRS, FE, JBHT, CMI, EIX, ED, DTE, COO, AEE, NUE, CHD","FRT, ROP, PNW, CINF, INCY, GL, BXP, BRO, ROL, POOL, DHI, HOLX, DOV, LNC, AFL, AVY, STT, ROK, MHK, VMC, BAX, SWK, TER, APD, ESS"
2010-06,"SJM, COO, PNW, AOS, ADM, ED, FE, ATO, CMS, DTE, SWK, LNC, POOL, NTRS, ROK, ESS, BXP, SNA, HOLX, IEX, RHI, DOV, APD, MAA, AVY","JBHT, PPG, CINF, FRT, CHD, CMI, GL, BAX, AEE, ROP, AFL, TTWO, ROL, DHI, MHK, INCY, VMC, EMN, STT, TER, NUE, HBAN, EIX, BRO, FDS"
2010-07,"MAA, HBAN, SNA, ESS, CMS, JBHT, AEE, BAX, CINF, GL, ATO, LNC, FE, ED, MHK, RHI, ADM, CHD, ROL, EIX, PNW, BRO, VMC, NUE, CMI","DTE, SJM, EMN, INCY, BXP, AFL, STT, PPG, SWK, DOV, TTWO, AOS, APD, IEX, FRT, DHI, FDS, ROP, AVY, TER, ROK, HOLX, NTRS, POOL, COO"
2010-08,"CMS, PNW, COO, ED, ADM, AEE, APD, EIX, DTE, FRT, MAA, ESS, HOLX, STT, MHK, AVY, SNA, CHD, SWK, JBHT, GL, IEX, ROP, DHI, DOV","CMI, ROL, NUE, AOS, ROK, PPG, BRO, SJM, AFL, INCY, CINF, FE, BAX, ATO, TTWO, VMC, POOL, TER, RHI, HBAN, LNC, FDS, NTRS, EMN, BXP"
2010-09,"POOL, DHI, CINF, GL, HBAN, STT, FE, BRO, CHD, JBHT, ATO, NTRS, SJM, ADM, CMS, NUE, PNW, ESS, MAA, INCY, TER, TTWO, CMI, ROK, RHI","MHK, EMN, FRT, ED, LNC, BXP, IEX, DOV, AVY, ROL, COO, SWK, SNA, HOLX, AOS, ROP, BAX, APD, PPG, FDS, AFL, EIX, AEE, VMC, DTE"
2010-10,"SNA, EIX, FDS, GL, AFL, MHK, BAX, EMN, COO, ROP, SJM, PPG, TTWO, MAA, ADM, BXP, RHI, ESS, INCY, JBHT, CINF, NTRS, AEE, APD, ED","DTE, LNC, ROL, STT, BRO, CMS, SWK, DOV, IEX, CHD, FRT, ROK, NUE, TER, ATO, POOL, HOLX, DHI, FE, AOS, CMI, AVY, VMC, HBAN, PNW"
2010-11,"VMC, COO, ROK, AOS, TER, POOL, ROP, IEX, SNA, TTWO, ROL, STT, AVY, DOV, HBAN, BRO, CINF, HOLX, RHI, ATO, CMI, PPG, MAA, JBHT, APD","NTRS, FDS, GL, EIX, MHK, AFL, FRT, DTE, BAX, SWK, DHI, FE, BXP, ED, LNC, CMS, ADM, INCY, ESS, SJM, NUE, EMN, CHD, AEE, PNW"
2010-12,"ROK, PPG, EMN, MHK, SNA, STT, DOV, FE, POOL, CHD, FDS, ROP, APD, COO, CINF, BRO, ATO, CMS, EIX, SJM, IEX, ADM, BAX, GL, ED","MAA, ESS, BXP, PNW, DHI, TER, HBAN, LNC, NUE, HOLX, INCY, CMI, AVY, SWK, JBHT, VMC, RHI, TTWO, AFL, NTRS, ROL, DTE, FRT, AOS, AEE"
2011-01,"DOV, SWK, ADM, POOL, FDS, HOLX, FE, NUE, HBAN, CMS, ATO, GL, FRT, DHI, LNC, BRO, DTE, RHI, ESS, CINF, AFL, TER, ROK, AOS, EMN","BXP, AEE, COO, TTWO, ROP, IEX, STT, ED, JBHT, MAA, PPG, SNA, NTRS, SJM, EIX, VMC, ROL, CMI, BAX, APD, MHK, INCY, PNW, AVY, CHD"
2011-02,"CHD, BAX, ROP, ROK, COO, VMC, ESS, CINF, BRO, APD, PNW, GL, PPG, FRT, MHK, NUE, IEX, SWK, FDS, ATO, ROL, TTWO, MAA, POOL, EIX","AFL, ADM, TER, SJM, LNC, DTE, RHI, BXP, JBHT, SNA, HOLX, EMN, DOV, ED, INCY, HBAN, AOS, AVY, CMI, DHI, STT, FE, AEE, CMS, NTRS"
2011-03,"AOS, JBHT, CMI, PPG, ROK, EMN, IEX, AVY, CHD, MHK, SNA, SJM, DTE, ROL, CMS, ROP, DOV, ED, INCY, COO, HOLX, GL, ATO, SWK, PNW","BAX, STT, AEE, ESS, FDS, VMC, AFL, LNC, TER, TTWO, NUE, CINF, RHI, POOL, FRT, HBAN, ADM, APD, NTRS, EIX, DHI, BRO, MAA, BXP, FE"
2011-04,"CMI, EMN, EIX, FRT, COO, FE, IEX, DHI, APD, AFL, BAX, AEE, TTWO, SJM, JBHT, FDS, DTE, MAA, STT, LNC, CHD, DOV, ROL, POOL, NUE","SNA, ADM, ED, HBAN, ATO, INCY, BXP, ESS, PNW, GL, CMS, BRO, ROP, TER, ROK, SWK, CINF, MHK, NTRS, VMC, RHI, AOS, HOLX, PPG, AVY"
2011-05,"SJM, PNW, BAX, BXP, MAA, DTE, BRO, FE, MHK, CHD, ED, SWK, ESS, AVY, AEE, FDS, TTWO, CMS, EIX, FRT, COO, NUE, RHI, PPG, LNC","AOS, ROK, ATO, INCY, ROL, CINF, JBHT, ROP, IEX, HBAN, NTRS, HOLX, SNA, DHI, AFL, ADM, CMI, VMC, STT, EMN, DOV, GL, TER, APD, POOL"
2011-06,"INCY, COO, ROK, SNA, PPG, JBHT, AOS, ROL, ED, DOV, IEX, ATO, APD, BAX, FE, MHK, AVY, TER, FDS, TTWO, ADM, HOLX, NTRS, DHI, VMC","CINF, EMN, CHD, DTE, SJM, GL, AEE, LNC, FRT, NUE, BRO, BXP, SWK, AFL, ESS, MAA, EIX, PNW, STT, RHI, CMI, POOL, HBAN, ROP, CMS"
2011-07,"MAA, ESS, FRT, DHI, SJM, BXP, CMI, RHI, AEE, FE, DTE, ADM, ATO, IEX, SNA, TER, SWK, HOLX, INCY, STT, HBAN, PPG, LNC, APD, ROL","GL, CINF, PNW, EMN, NUE, JBHT, COO, CMS, BAX, ROP, AVY, ROK, BRO, MHK, TTWO, VMC, DOV, POOL, FDS, AOS, NTRS, AFL, ED, EIX, CHD"
2011-08,"ROL, CHD, ED, PNW, AEE, FRT, CMS, ESS, VMC, CINF, MAA, DTE, ATO, PPG, INCY, AVY, APD, SJM, NUE, SNA, ADM, SWK, ROP, GL, AOS","DOV, MHK, FDS, BAX, BRO, POOL, LNC, BXP, EIX, TTWO, AFL, HBAN, NTRS, EMN, STT, RHI, DHI, CMI, JBHT, ROK, HOLX, TER, IEX, COO, FE"
2011-09,"COO, EIX, FE, ED, CHD, SJM, CMS, POOL, FDS, BAX, STT, TER, FRT, NTRS, GL, HOLX, PPG, APD, AFL, CINF, HBAN, TTWO, DTE, LNC, VMC","SWK, PNW, ATO, DOV, AOS, EMN, ESS, IEX, MAA, SNA, BRO, BXP, AVY, DHI, MHK, INCY, ADM, NUE, ROK, CMI, RHI, ROP, ROL, JBHT, AEE"
2011-10,"HBAN, FRT, AEE, DTE, EIX, AVY, PNW, HOLX, ATO, SJM, CMS, TER, SWK, MAA, AFL, STT, RHI, TTWO, BRO, DHI, MHK, PPG, LNC, CMI, SNA","ROK, NUE, ESS, DOV, ROP, GL, JBHT, ADM, NTRS, ROL, AOS, EMN, IEX, APD, VMC, FDS, BXP, POOL, CINF, ED, FE, COO, BAX, INCY, CHD"
2011-11,"HOLX, JBHT, DHI, LNC, AOS, AEE, ROP, PNW, GL, POOL, NUE, ADM, VMC, MHK, IEX, ED, SWK, CINF, ROK, ROL, PPG, HBAN, DTE, EMN, CMS","RHI, CHD, INCY, MAA, NTRS, ESS, FDS, BAX, TER, BRO, SNA, AFL, BXP, EIX, CMI, APD, COO, TTWO, STT, AVY, SJM, FE, DOV, FRT, ATO"
2011-12,"MHK, AVY, MAA, INCY, BRO, RHI, CMS, DOV, DHI, ESS, ED, NTRS, EIX, HBAN, BXP, SWK, CHD, SJM, DTE, VMC, CINF, FRT, AOS, COO, ROP","GL, IEX, APD, STT, PNW, TER, FE, ROL, NUE, AFL, CMI, FDS, ADM, PPG, BAX, LNC, TTWO, AEE, ROK, ATO, EMN, JBHT, POOL, SNA, HOLX"
2012-01,"DOV, IEX, CINF, ROP, PPG, ROK, AOS, GL, BXP, HBAN, FRT, NTRS, APD, SWK, ESS, EMN, COO, MHK, MAA, TER, CMI, INCY, HOLX, TTWO, NUE","JBHT, POOL, BAX, SNA, AFL, VMC, LNC, DHI, FDS, SJM, BRO, ADM, ED, FE, AVY, ROL, AEE, ATO, RHI, STT, PNW, DTE, CMS, CHD, EIX"
2012-02,"SWK, ADM, SNA, NTRS, STT, CINF, EMN, POOL, AOS, GL, CHD, FE, BAX, BRO, MHK, IEX, DHI, ROK, RHI, APD, HBAN, EIX, CMI, LNC, AVY","COO, PPG, HOLX, VMC, DTE, AEE, DOV, FRT, PNW, TER, JBHT, ROL, ATO, SJM, INCY, ESS, BXP, NUE, AFL, CMS, ROP, ED, MAA, FDS, TTWO"
2012-03,"SJM, ROP, ESS, STT, MAA, RHI, NTRS, JBHT, LNC, DHI, PPG, ROL, MHK, FE, HOLX, CMS, CHD, ATO, BXP, GL, TER, BAX, COO, POOL, ADM","INCY, FDS, HBAN, DTE, PNW, APD, AEE, ED, EIX, FRT, IEX, BRO, SNA, SWK, ROK, EMN, VMC, AFL, CINF, NUE, DOV, AVY, AOS, TTWO, CMI"
2012-04,"PPG, COO, DHI, AVY, AOS, FDS, ESS, EMN, FRT, CMS, CINF, HBAN, EIX, BXP, ATO, DTE, CHD, IEX, ROP, FE, SNA, STT, INCY, BRO, AEE","TER, ED, JBHT, MAA, PNW, NTRS, MHK, VMC, TTWO, NUE, BAX, APD, LNC, SWK, CMI, ROK, ADM, GL, SJM, AFL, HOLX, RHI, POOL, DOV, ROL"
2012-05,"CHD, ADM, JBHT, PNW, EIX, ATO, MHK, DHI, ED, CMS, CINF, DTE, FDS, POOL, MAA, DOV, SWK, NTRS, AVY, NUE, BAX, IEX, APD, ROK, INCY","BRO, BXP, ESS, RHI, GL, SJM, COO, SNA, AOS, FRT, HBAN, VMC, TTWO, CMI, LNC, TER, EMN, HOLX, AFL, STT, PPG, AEE, ROP, FE, ROL"
2012-06,"POOL, GL, STT, EMN, HOLX, AFL, ATO, BRO, NTRS, INCY, FE, NUE, FRT, AOS, LNC, ROL, CINF, BXP, BAX, PNW, CHD, JBHT, DTE, ED, AEE","SNA, PPG, EIX, MHK, ESS, APD, VMC, DHI, CMS, MAA, RHI, CMI, ROK, ADM, COO, AVY, DOV, SWK, TER, ROP, HBAN, TTWO, FDS, IEX, SJM"
2012-07,"SNA, ROL, FRT, CMS, TER, SWK, NUE, DTE, EMN, CHD, ED, PNW, AEE, PPG, ESS, BXP, AFL, HOLX, ATO, FE, AVY, BAX, INCY, ROK, SJM","DOV, MAA, AOS, ROP, EIX, CINF, APD, FDS, STT, POOL, LNC, JBHT, BRO, TTWO, COO, RHI, MHK, DHI, VMC, HBAN, IEX, ADM, GL, CMI, NTRS"
2012-08,"MHK, DHI, ROK, POOL, TER, DOV, HOLX, HBAN, EMN, AFL, IEX, BRO, ROP, GL, STT, APD, ADM, SNA, NTRS, CINF, TTWO, LNC, COO, AOS, SJM","AVY, CMI, BXP, PPG, VMC, BAX, CMS, ED, EIX, CHD, DTE, JBHT, AEE, NUE, ESS, PNW, RHI, ATO, INCY, FE, SWK, ROL, MAA, FDS, FRT"
2012-09,"DHI, ROP, POOL, AOS, PPG, FDS, IEX, HBAN, AFL, EIX, LNC, SNA, DOV, ATO, EMN, CMS, HOLX, VMC, AVY, PNW, BAX, DTE, ADM, SJM, FE","SWK, COO, MHK, TTWO, RHI, NUE, STT, ROL, GL, APD, INCY, TER, CMI, MAA, ROK, ESS, FRT, CINF, BXP, CHD, JBHT, BRO, ED, AEE, NTRS"
2012-10,"SNA, STT, TTWO, CINF, NUE, AOS, BAX, DTE, EMN, MHK, AFL, FE, NTRS, EIX, CMS, FRT, TER, LNC, ROK, JBHT, HOLX, PPG, ESS, AEE, IEX","AVY, COO, DHI, CMI, POOL, RHI, ED, ATO, PNW, SWK, HBAN, FDS, CHD, APD, BXP, ROL, VMC, DOV, BRO, INCY, GL, ADM, MAA, SJM, ROP"
2012-11,"DOV, APD, TER, CHD, AFL, IEX, PPG, BAX, RHI, BRO, CMI, AOS, SWK, AVY, SJM, GL, MHK, SNA, EMN, NUE, ROP, FDS, VMC, ROK, TTWO","INCY, CINF, CMS, JBHT, NTRS, ROL, AEE, ED, HOLX, DHI, FE, ESS, HBAN, FRT, BXP, EIX, MAA, ATO, DTE, PNW, COO, ADM, POOL, STT, LNC"
2012-12,"PPG, TER, ROK, STT, MHK, HOLX, LNC, NUE, NTRS, AVY, ESS, DOV, MAA, HBAN, IEX, ADM, BXP, SWK, AEE, RHI, EMN, CMI, DHI, POOL, ATO","APD, AFL, JBHT, ED, BAX, AOS, INCY, BRO, FDS, CINF, COO, ROL, TTWO, SJM, VMC, PNW, DTE, EIX, GL, CHD, FE, CMS, SNA, ROP, FRT"
2013-01,"AOS, HBAN, COO, CINF, VMC, POOL, CHD, GL, NUE, EIX, BRO, IEX, AEE, DTE, ATO, ROK, CMI, ESS, ROP, CMS, DOV, FDS, EMN, APD, PNW","SWK, ADM, NTRS, DHI, SJM, SNA, BAX, FRT, ED, HOLX, STT, JBHT, MHK, ROL, LNC, AVY, RHI, INCY, TTWO, PPG, MAA, BXP, TER, FE, AFL"
2013-02,"SJM, MAA, CHD, ROP, AVY, CINF, DOV, PNW, DTE, FDS, COO, MHK, AEE, ED, TER, JBHT, AOS, CMS, NTRS, INCY, TTWO, IEX, SWK, LNC, ATO","ADM, BRO, STT, ROK, GL, HBAN, CMI, RHI, FRT, VMC, HOLX, AFL, DHI, ESS, FE, PPG, NUE, EMN, BXP, APD, SNA, ROL, BAX, EIX, POOL"
2013-03,"DHI, FE, BAX, JBHT, BRO, MHK, ADM, GL, RHI, CMS, AVY, INCY, POOL, CINF, AFL, IEX, HBAN, CHD, EIX, SJM, ED, STT, AEE, HOLX, SNA","PNW, SWK, AOS, NTRS, NUE, DTE, ROP, ATO, LNC, TTWO, COO, FRT, VMC, ESS, APD, ROL, CMI, EMN, FDS, ROK, TER, BXP, MAA, DOV, PPG"
2013-04,"PPG, FRT, BXP, DTE, EIX, DHI, CMS, PNW, ESS, AEE, AFL, CINF, LNC, ED, SNA, SJM, ATO, GL, AOS, POOL, COO, FE, FDS, TER, APD","ADM, HOLX, CMI, SWK, ROP, TTWO, INCY, DOV, NUE, JBHT, EMN, VMC, BRO, BAX, AVY, IEX, HBAN, RHI, MHK, ROK, CHD, ROL, NTRS, STT, MAA"
2013-05,"TER, TTWO, APD, HBAN, NTRS, EMN, VMC, IEX, RHI, SWK, SNA, LNC, POOL, AVY, BRO, PPG, FDS, AOS, GL, ROP, ROL, ROK, JBHT, COO, AFL","NUE, DOV, STT, CMI, HOLX, BAX, MHK, INCY, ESS, CMS, DTE, FRT, DHI, PNW, AEE, ADM, ATO, CHD, CINF, BXP, SJM, FE, EIX, ED, MAA"
2013-06,"ADM, COO, AFL, EIX, FDS, ED, ROL, SJM, LNC, POOL, CHD, CMS, HBAN, MHK, AEE, ESS, GL, DTE, ROP, VMC, CMI, AOS, HOLX, ROK, PPG","RHI, FRT, FE, APD, CINF, NUE, SWK, EMN, IEX, TER, DHI, TTWO, ATO, PNW, JBHT, AVY, BAX, SNA, STT, BXP, INCY, NTRS, DOV, MAA, BRO"
2013-07,"PPG, HBAN, GL, SJM, NUE, ATO, CINF, ADM, STT, FDS, COO, DTE, INCY, BAX, PNW, AFL, SNA, MHK, AVY, AEE, EIX, JBHT, CHD, CMS, ED","BRO, FRT, ESS, BXP, APD, HOLX, TTWO, ROK, EMN, LNC, AOS, RHI, CMI, IEX, DOV, SWK, FE, NTRS, ROP, POOL, TER, DHI, VMC, ROL, MAA"
2013-08,"INCY, TTWO, COO, AOS, CMI, VMC, LNC, SWK, ROK, ATO, EIX, MAA, FRT, PNW, TER, CHD, CINF, AFL, NTRS, FDS, ED, HOLX, APD, SJM, BRO","AEE, EMN, DTE, RHI, BAX, AVY, CMS, STT, BXP, JBHT, HBAN, ADM, ROL, GL, NUE, PPG, DHI, ESS, ROP, FE, SNA, POOL, MHK, DOV, IEX"
2013-09,"IEX, DHI, VMC, CMI, POOL, AFL, NUE, TER, AOS, ROL, ROP, PPG, FDS, SNA, ATO, SWK, DOV, ADM, GL, APD, BXP, FRT, BRO, CINF, ESS","AEE, EMN, AVY, INCY, RHI, MHK, ROK, CHD, MAA, JBHT, PNW, EIX, HBAN, BAX, HOLX, STT, DTE, FE, TTWO, ED, NTRS, CMS, COO, SJM, LNC"
2013-10,"ESS, PPG, CHD, HOLX, AVY, LNC, EIX, HBAN, CINF, STT, NUE, MAA, IEX, TER, SJM, DTE, ED, AEE, AFL, SNA, NTRS, CMS, ROL, ATO, FE","VMC, ROK, APD, FRT, JBHT, PNW, INCY, DOV, AOS, ADM, MHK, EMN, BAX, GL, ROP, CMI, POOL, BXP, DHI, SWK, TTWO, RHI, BRO, COO, FDS"
2013-11,"MHK, VMC, AOS, DHI, CINF, NTRS, GL, CMI, HBAN, BAX, AVY, FDS, STT, IEX, POOL, SWK, ROK, ROP, AFL, SNA, INCY, LNC, COO, ROL, PPG","ATO, RHI, JBHT, CHD, HOLX, TTWO, MAA, SJM, EIX, ESS, ED, BXP, PNW, DTE, TER, CMS, EMN, FE, ADM, NUE, DOV, AEE, BRO, APD, FRT"
2013-12,"RHI, INCY, ROL, ADM, CMI, ROP, DOV, MHK, TTWO, VMC, HBAN, NTRS, EMN, ROK, NUE, POOL, SNA, IEX, TER, PPG, ATO, JBHT, GL, APD, AVY","FE, CHD, DHI, BAX, AFL, ED, STT, BXP, CMS, AEE, MAA, LNC, EIX, COO, ESS, FDS, FRT, SWK, PNW, BRO, DTE, AOS, HOLX, CINF, SJM"
2014-01,"FRT, TER, MAA, AEE, ATO, DHI, EIX, VMC, CMS, DTE, INCY, ESS, BXP, TTWO, COO, BRO, CMI, ADM, NUE, SNA, STT, SJM, LNC, POOL, CINF","AFL, HBAN, APD, ROL, FE, MHK, HOLX, PPG, GL, SWK, EMN, JBHT, ROK, FDS, CHD, IEX, NTRS, AOS, DOV, ED, AVY, BAX, ROP, PNW, RHI"
2014-02,"DOV, EIX, PPG, POOL, TER, SWK, ROK, PNW, AEE, MAA, ESS, CHD, AOS, DTE, HBAN, LNC, DHI, IEX, BXP, NUE, SJM, ROL, COO, GL, TTWO","ED, ADM, NTRS, CMS, FRT, AFL, APD, CMI, EMN, SNA, VMC, HOLX, BAX, AVY, BRO, JBHT, ATO, CINF, FE, RHI, INCY, STT, ROP, MHK, FDS"
2014-03,"EIX, ADM, COO, NTRS, STT, BAX, POOL, HBAN, DOV, CMS, CINF, DTE, ATO, FRT, RHI, FDS, CMI, BRO, CHD, FE, TTWO, AEE, ROK, BXP, AVY","ESS, ROL, SNA, GL, LNC, MAA, NUE, JBHT, AOS, MHK, ED, IEX, SJM, SWK, VMC, INCY, DHI, TER, PPG, APD, PNW, ROP, EMN, HOLX, AFL"
2014-04,"ATO, ED, RHI, SWK, DOV, DTE, JBHT, ROP, CMS, FRT, NUE, DHI, BXP, ESS, PNW, IEX, SNA, MAA, AOS, EMN, AEE, GL, CMI, CINF, ADM","EIX, PPG, INCY, HBAN, NTRS, TTWO, STT, ROK, LNC, COO, POOL, AVY, BRO, VMC, MHK, HOLX, TER, FDS, FE, APD, SJM, ROL, AFL, BAX, CHD"
2014-05,"DHI, SJM, AOS, MAA, ESS, AVY, PPG, IEX, BXP, ADM, MHK, BAX, ROP, APD, JBHT, INCY, HOLX, ROL, GL, RHI, SWK, FRT, ROK, CMI, BRO","EMN, TTWO, HBAN, STT, SNA, DOV, TER, CINF, FDS, CHD, NTRS, FE, VMC, ED, AEE, DTE, EIX, AFL, POOL, COO, NUE, ATO, CMS, PNW, LNC"
2014-06,"TTWO, ATO, LNC, APD, NTRS, ED, PNW, EIX, IEX, RHI, COO, DOV, CMS, VMC, PPG, SJM, DHI, AEE, ROK, FE, HOLX, ROP, STT, HBAN, DTE","AFL, ESS, BRO, INCY, FDS, TER, MHK, CHD, SNA, GL, CMI, FRT, AVY, MAA, SWK, AOS, JBHT, BAX, NUE, BXP, CINF, ROL, POOL, ADM, EMN"
2014-07,"ADM, STT, NTRS, JBHT, BAX, HBAN, ESS, APD, HOLX, NUE, COO, RHI, LNC, FRT, BXP, SNA, TTWO, BRO, SWK, MHK, CMI, ATO, EMN, CHD, PNW","AVY, CMS, TER, SJM, IEX, AOS, DOV, ROL, PPG, EIX, AEE, DTE, MAA, AFL, GL, CINF, POOL, ED, DHI, INCY, ROK, FE, ROP, VMC, FDS"
2014-08,"FE, NUE, EIX, PNW, ADM, CMS, CHD, FDS, DTE, BRO, AOS, LNC, ROL, TTWO, DHI, EMN, ROP, ATO, SWK, CINF, MAA, ROK, CMI, AEE, SNA","PPG, NTRS, POOL, GL, ED, RHI, SJM, AFL, DOV, STT, FRT, ESS, MHK, INCY, TER, AVY, IEX, BXP, COO, APD, VMC, BAX, HBAN, HOLX, JBHT"
2014-09,"CHD, ADM, STT, INCY, MAA, CMI, DOV, MHK, ESS, AVY, IEX, TER, EIX, ROK, DHI, FRT, ATO, VMC, BXP, COO, POOL, FDS, AFL, BAX, AEE","PPG, PNW, GL, AOS, SWK, SJM, CMS, ROP, DTE, SNA, LNC, APD, HOLX, CINF, RHI, JBHT, EMN, NTRS, TTWO, ROL, HBAN, BRO, ED, FE, NUE"
2014-10,"SNA, DTE, ROL, CINF, ROP, FDS, JBHT, HOLX, MAA, SWK, MHK, COO, SJM, AVY, APD, INCY, PPG, IEX, CHD, STT, AFL, VMC, HBAN, ROK, LNC","TTWO, ESS, AOS, EIX, PNW, FRT, ED, RHI, AEE, FE, ATO, DHI, CMI, POOL, CMS, BXP, GL, EMN, NUE, ADM, TER, NTRS, BAX, DOV, BRO"
2014-11,"MHK, TER, PPG, VMC, APD, CHD, AVY, MAA, TTWO, FDS, BAX, PNW, LNC, RHI, JBHT, COO, IEX, ROK, EMN, SNA, HOLX, BXP, NTRS, ROL, HBAN","INCY, ADM, DHI, AEE, GL, STT, EIX, BRO, AOS, ATO, CMS, CINF, SWK, FRT, ESS, AFL, DOV, SJM, FE, DTE, NUE, POOL, CMI, ED, ROP"
2014-12,"PNW, POOL, AEE, FE, DTE, PPG, CMS, ED, AVY, AOS, ATO, HBAN, CHD, RHI, EIX, FDS, AFL, ROL, JBHT, STT, BRO, ESS, LNC, SWK, CINF","SNA, MAA, TTWO, IEX, MHK, GL, FRT, BAX, APD, NUE, EMN, DOV, COO, INCY, ROK, SJM, ROP, ADM, BXP, DHI, NTRS, VMC, CMI, TER, HOLX"
2015-01,"INCY, CMS, FRT, VMC, MHK, MAA, TTWO, AOS, ED, EIX, DTE, FE, PNW, CHD, SJM, ATO, FDS, HOLX, BXP, ESS, APD, AVY, STT, TER, GL","IEX, AFL, BRO, EMN, JBHT, HBAN, PPG, BAX, CMI, DHI, SNA, COO, NTRS, DOV, ROK, LNC, NUE, ADM, SWK, POOL, CINF, ROP, AEE, RHI, ROL"
2015-02,"HBAN, AFL, ROP, FDS, NUE, INCY, ROK, JBHT, APD, IEX, NTRS, TER, RHI, HOLX, GL, AOS, PPG, CHD, EMN, SWK, CINF, BRO, STT, COO, DOV","ADM, AVY, VMC, LNC, SJM, MHK, DHI, POOL, SNA, CMI, ROL, ED, DTE, PNW, MAA, CMS, ATO, AEE, EIX, FE, TTWO, BAX, ESS, FRT, BXP"
2015-03,"INCY, MAA, ATO, DHI, AOS, FRT, AFL, BRO, ESS, GL, ROP, FDS, BXP, HOLX, COO, ROL, VMC, FE, NUE, HBAN, CINF, SJM, POOL, MHK, CHD","SNA, JBHT, CMS, EMN, PPG, TTWO, DOV, APD, SWK, EIX, ED, TER, RHI, CMI, IEX, DTE, STT, AVY, BAX, PNW, AEE, ADM, ROK, LNC, NTRS"
2015-04,"DOV, INCY, AVY, NTRS, STT, SWK, NUE, ADM, GL, FE, ROK, HOLX, JBHT, EMN, SNA, VMC, BAX, ED, ROL, SJM, FRT, RHI, TTWO, POOL, MHK","BXP, COO, CHD, APD, CINF, PNW, BRO, MAA, TER, ESS, CMS, AOS, ATO, ROP, AEE, DHI, EIX, PPG, LNC, AFL, HBAN, FDS, IEX, DTE, CMI"
2015-05,"ADM, MHK, HOLX, VMC, FDS, ROP, SNA, SWK, ROK, CHD, MAA, IEX, PPG, DHI, HBAN, APD, SJM, POOL, COO, TER, TTWO, INCY, AOS, AVY, NTRS","BRO, GL, RHI, LNC, STT, EMN, CMS, FRT, PNW, ED, ESS, ROL, ATO, JBHT, NUE, BAX, CMI, AEE, BXP, AFL, FE, DTE, DOV, EIX, CINF"
2015-06,"EMN, HOLX, POOL, BAX, DHI, LNC, SNA, SWK, NTRS, MHK, GL, ROL, ROK, IEX, HBAN, BRO, AOS, TTWO, AFL, PPG, EIX, TER, ADM, SJM, FE","BXP, NUE, APD, PNW, VMC, DOV, AEE, CMS, DTE, ED, INCY, FRT, MAA, ESS, ATO, CHD, CMI, COO, JBHT, AVY, ROP, FDS, RHI, STT, CINF"
2015-07,"ED, HOLX, DTE, EIX, DHI, PNW, VMC, ATO, CMS, FRT, ESS, CHD, GL, MHK, BAX, APD, FE, HBAN, SNA, SJM, AFL, JBHT, BXP, TTWO, CINF","MAA, AEE, FDS, BRO, ROL, NUE, SWK, NTRS, AVY, POOL, INCY, DOV, ROK, PPG, LNC, EMN, IEX, ROP, ADM, CMI, RHI, COO, AOS, TER, STT"
2015-08,"SJM, VMC, DHI, INCY, AOS, LNC, NTRS, AFL, COO, BXP, TTWO, EMN, RHI, HOLX, HBAN, TER, STT, CMI, FE, FRT, CINF, IEX, ADM, GL, FDS","ESS, AVY, CMS, ROK, BRO, BAX, SWK, ROL, DOV, SNA, DTE, ROP, PNW, EIX, MHK, APD, JBHT, PPG, NUE, AEE, MAA, ED, POOL, ATO, CHD"
2015-09,"CMS, EIX, PNW, ED, ATO, FRT, AEE, BXP, MAA, POOL, ESS, DTE, CINF, FDS, AOS, HOLX, RHI, ROK, APD, COO, MHK, PPG, ADM, DOV, LNC","STT, SNA, INCY, VMC, SWK, GL, ROL, ROP, DHI, BRO, HBAN, SJM, NTRS, CHD, BAX, NUE, EMN, CMI, AVY, JBHT, TTWO, FE, IEX, AFL, TER"
2015-10,"SNA, SWK, AFL, APD, FDS, TER, ATO, VMC, IEX, ROK, MHK, JBHT, BXP, INCY, FRT, AEE, BRO, HBAN, MAA, NTRS, STT, GL, RHI, SJM, CHD","DTE, COO, CMS, ROP, PPG, AOS, TTWO, AVY, BAX, NUE, CINF, POOL, LNC, DOV, EMN, ADM, DHI, CMI, EIX, ED, PNW, HOLX, ESS, FE, ROL"
2015-11,"DHI, HBAN, TTWO, NTRS, TER, VMC, STT, MAA, ESS, GL, AOS, ROP, HOLX, SNA, SJM, LNC, IEX, SWK, JBHT, AFL, DOV, FRT, AVY, CINF, PPG","ROL, PNW, BAX, EMN, FE, POOL, BRO, AEE, ED, COO, FDS, CMI, ADM, CMS, RHI, INCY, ROK, MHK, NUE, EIX, APD, DTE, ATO, BXP, CHD"
2015-12,"ED, CMS, ESS, MAA, SJM, FE, BXP, ATO, PNW, BAX, ADM, LNC, STT, COO, AFL, RHI, VMC, EMN, DOV, PPG, JBHT, GL, HBAN, INCY, APD","AVY, HOLX, ROL, AOS, FDS, NTRS, CINF, ROK, IEX, NUE, SWK, CMI, ROP, TTWO, POOL, AEE, BRO, MHK, CHD, DHI, DTE, FRT, EIX, TER, SNA"
2016-01,"ATO, ED, CMS, DTE, ROL, EIX, AEE, POOL, FE, SJM, FRT, MAA, PNW, CMI, AOS, EMN, BXP, ROP, FDS, RHI, VMC, ROK, TER, BRO, SNA","IEX, GL, DOV, INCY, BAX, PPG, ADM, AFL, HBAN, LNC, AVY, COO, NUE, APD, STT, DHI, NTRS, HOLX, MHK, SWK, ESS, CINF, CHD, JBHT, TTWO"
2016-02,"CINF, COO, ROK, CMI, CHD, MHK, BAX, AVY, BRO, JBHT, PNW, EMN, APD, AEE, INCY, IEX, DOV, TTWO, AFL, HOLX, VMC, EIX, HBAN, CMS, PPG","FE, ED, AOS, NUE, ATO, LNC, GL, POOL, NTRS, ROP, MAA, DHI, SNA, RHI, FRT, TER, ESS, BXP, STT, ADM, DTE, SJM, SWK, FDS, ROL"
2016-03,"NTRS, POOL, PNW, HBAN, SNA, ROP, AOS, APD, FE, CMS, DTE, COO, ATO, VMC, LNC, AFL, STT, AEE, DOV, MHK, GL, EIX, FRT, ADM, TTWO","BAX, CINF, NUE, SJM, RHI, PPG, CMI, MAA, TER, DHI, EMN, SWK, ESS, AVY, BXP, BRO, JBHT, ED, IEX, ROK, CHD, FDS, INCY, ROL, HOLX"
2016-04,"ADM, NTRS, AFL, BAX, GL, STT, EMN, CMI, SWK, HBAN, NUE, DOV, LNC, VMC, BXP, APD, CINF, SNA, AOS, MHK, AVY, CHD, FE, TTWO, MAA","ESS, CMS, ROP, AEE, PNW, HOLX, ED, ATO, SJM, RHI, TER, FRT, BRO, JBHT, IEX, PPG, EIX, ROL, DTE, COO, DHI, FDS, INCY, ROK, POOL"
2016-05,"RHI, MAA, VMC, ADM, AOS, GL, COO, CHD, LNC, ROL, FDS, TER, POOL, CINF, NTRS, HBAN, AEE, ESS, CMS, BRO, AVY, HOLX, ROK, PNW, IEX","MHK, INCY, TTWO, SJM, DTE, DHI, DOV, SNA, EIX, STT, SWK, FRT, AFL, FE, ATO, EMN, ROP, NUE, BXP, PPG, BAX, APD, CMI, ED, JBHT"
2016-06,"DTE, EIX, CINF, AEE, FRT, FE, AOS, COO, BXP, CHD, BAX, DOV, AFL, BRO, ROL, MAA, DHI, VMC, POOL, SJM, ATO, ED, CMS, PNW, NUE","FDS, ADM, AVY, HOLX, ESS, GL, RHI, EMN, INCY, MHK, PPG, TTWO, SNA, LNC, STT, HBAN, NTRS, JBHT, IEX, SWK, CMI, ROK, APD, ROP, TER"
2016-07,"NUE, SWK, IEX, CMI, POOL, BXP, HBAN, FDS, BAX, COO, TTWO, APD, AOS, ADM, DHI, AVY, ESS, FRT, DOV, STT, VMC, JBHT, NTRS, INCY, LNC","HOLX, MHK, SJM, PPG, CINF, GL, TER, EIX, AFL, FE, CHD, RHI, ROL, EMN, PNW, BRO, ATO, CMS, AEE, DTE, ED, SNA, ROK, MAA, ROP"
2016-08,"TTWO, STT, TER, HBAN, RHI, GL, IEX, NTRS, ROP, APD, AOS, EMN, FDS, CINF, AFL, CMI, BRO, LNC, COO, MHK, SWK, DOV, ROK, CHD, ROL","PPG, NUE, VMC, SJM, ATO, CMS, FRT, FE, ED, EIX, AEE, DTE, JBHT, PNW, ADM, ESS, BAX, DHI, SNA, MAA, INCY, BXP, POOL, AVY, HOLX"
2016-09,"ROK, TTWO, ROL, CMI, ROP, JBHT, TER, AOS, DOV, FE, BAX, INCY, NUE, ATO, PNW, HOLX, BRO, ED, DTE, CMS, AVY, IEX, VMC, FDS, POOL","MHK, DHI, SJM, COO, APD, CHD, FRT, NTRS, ADM, BXP, AFL, LNC, CINF, PPG, ESS, HBAN, GL, STT, RHI, EIX, AEE, SNA, EMN, SWK, MAA"
2016-10,"HBAN, TER, EMN, NTRS, ROL, LNC, FE, DTE, ADM, AEE, EIX, SNA, STT, CHD, JBHT, ED, CMS, PNW, PPG, AVY, DOV, AOS, MHK, INCY, IEX","SWK, HOLX, CINF, FRT, ROP, FDS, DHI, AFL, APD, ESS, SJM, BRO, ROK, POOL, BXP, COO, TTWO, MAA, RHI, GL, VMC, NUE, CMI, ATO, BAX"
2016-11,"APD, IEX, POOL, DOV, SNA, CINF, AOS, MHK, HOLX, TER, ROP, EMN, ROL, SWK, LNC, AFL, FDS, AVY, PPG, NUE, BXP, RHI, BRO, INCY, HBAN","JBHT, NTRS, STT, ROK, VMC, CMI, TTWO, GL, ESS, CHD, FE, ED, BAX, COO, EIX, CMS, ATO, SJM, DHI, FRT, DTE, PNW, AEE, ADM, MAA"
2016-12,"RHI, NTRS, ESS, MAA, AEE, ED, ADM, COO, HBAN, DTE, ROL, PNW, GL, ATO, HOLX, EIX, TER, CMS, POOL, DOV, BRO, LNC, SNA, FDS, SJM","JBHT, BXP, CHD, FRT, MHK, ROK, ROP, BAX, EMN, TTWO, FE, NUE, IEX, CMI, SWK, AOS, AVY, INCY, AFL, STT, CINF, DHI, PPG, APD, VMC"
2017-01,"DHI, TTWO, SWK, MHK, BAX, CMI, SJM, SNA, FDS, PPG, COO, ROP, BXP, AVY, ROL, DOV, EMN, INCY, HBAN, AOS, ATO, VMC, CMS, CHD, JBHT","TER, ROK, EIX, LNC, AEE, POOL, HOLX, DTE, ED, AFL, IEX, NTRS, CINF, BRO, RHI, ADM, MAA, ESS, APD, FE, NUE, STT, PNW, FRT, GL"
2017-02,"INCY, EIX, ROP, MAA, POOL, COO, NUE, DHI, FE, PNW, BAX, BXP, TTWO, ADM, GL, NTRS, MHK, ESS, STT, CMS, HBAN, LNC, SJM, AEE, ROL","ED, AOS, EMN, AFL, CINF, DOV, FDS, DTE, ATO, IEX, SWK, RHI, PPG, BRO, ROK, AVY, CHD, CMI, APD, FRT, TER, HOLX, SNA, VMC, JBHT"
2017-03,"TER, SWK, HOLX, DHI, POOL, TTWO, ROK, PPG, CMI, ROL, BAX, ED, RHI, AOS, ATO, PNW, IEX, MHK, CMS, DOV, DTE, AFL, EMN, CHD, INCY","AVY, COO, VMC, FDS, SJM, LNC, JBHT, HBAN, FRT, BXP, NUE, APD, BRO, ESS, ROP, ADM, MAA, CINF, NTRS, FE, GL, AEE, SNA, EIX, STT"
2017-04,"BAX, ESS, HOLX, TTWO, ROP, STT, AOS, APD, ROL, PPG, NTRS, AFL, NUE, DTE, AVY, BRO, ATO, SWK, MHK, ED, PNW, TER, IEX, CMS, EIX","ROK, AEE, LNC, POOL, CINF, VMC, COO, INCY, FE, RHI, BXP, HBAN, SJM, MAA, JBHT, DOV, DHI, FRT, FDS, SNA, CHD, EMN, ADM, GL, CMI"
2017-05,"COO, BAX, ESS, DTE, DOV, PNW, CMI, ED, CMS, CHD, ROP, INCY, AEE, MAA, IEX, VMC, TTWO, ATO, APD, AOS, ROL, EIX, MHK, FDS, AVY","BRO, SWK, RHI, SJM, ROK, TER, AFL, EMN, ADM, FRT, NUE, JBHT, BXP, HOLX, SNA, PPG, STT, NTRS, CINF, HBAN, FE, GL, LNC, DHI, POOL"
2017-06,"COO, HBAN, JBHT, DHI, AVY, EMN, HOLX, IEX, LNC, PPG, AFL, RHI, CMI, CINF, MAA, FRT, AOS, ROK, BAX, SWK, NTRS, STT, ROP, VMC, BXP","GL, MHK, FE, CHD, FDS, ADM, ESS, ATO, SJM, ROL, TTWO, EIX, AEE, PNW, DTE, INCY, DOV, TER, SNA, CMS, ED, POOL, APD, BRO, NUE"
2017-07,"FE, TTWO, LNC, ROL, CINF, INCY, FRT, AVY, DOV, ATO, STT, BRO, CMI, GL, AEE, DHI, IEX, SJM, MHK, CHD, AFL, ED, ESS, TER, DTE","ADM, ROK, COO, PNW, EIX, FDS, ROP, SWK, NUE, POOL, RHI, AOS, PPG, VMC, HOLX, SNA, NTRS, MAA, HBAN, BXP, JBHT, EMN, BAX, CMS, APD"
2017-08,"JBHT, AEE, CMS, DTE, PNW, AOS, MAA, EMN, AFL, INCY, TTWO, TER, COO, BAX, SWK, ROL, APD, FE, EIX, ED, MHK, ESS, ATO, AVY, DHI","IEX, NTRS, DOV, CINF, BRO, RHI, POOL, LNC, FDS, CHD, CMI, HBAN, NUE, FRT, SNA, GL, ADM, SJM, HOLX, VMC, PPG, STT, ROP, ROK, BXP"
2017-09,"ROK, POOL, LNC, DOV, BRO, AOS, CMI, ROP, SWK, EMN, TER, PPG, TTWO, NTRS, AVY, ROL, GL, APD, ADM, IEX, STT, FDS, JBHT, RHI, HBAN","DHI, BXP, NUE, SNA, BAX, SJM, MAA, PNW, COO, HOLX, ESS, DTE, FE, ATO, CMS, EIX, AEE, ED, CHD, MHK, FRT, INCY, VMC, AFL, CINF"
2017-10,"AVY, TTWO, AEE, SWK, PPG, FE, ED, ROP, SNA, MHK, IEX, APD, FDS, CMI, GL, DOV, CMS, EIX, ATO, ESS, NUE, PNW, DTE, BRO, HOLX","LNC, AFL, RHI, BAX, TER, ROK, POOL, DHI, VMC, NTRS, COO, SJM, EMN, CINF, CHD, ROL, MAA, JBHT, ADM, STT, INCY, FRT, BXP, HBAN, AOS"
2017-11,"SJM, FRT, MHK, AVY, AOS, SNA, CINF, IEX, GL, ATO, ROL, PNW, FDS, SWK, DTE, NTRS, AFL, JBHT, HBAN, CHD, POOL, ROP, STT, FE, ED","BXP, VMC, AEE, CMS, BRO, APD, DOV, DHI, HOLX, RHI, EMN, EIX, BAX, LNC, MAA, TTWO, PPG, COO, ESS, TER, CMI, ROK, ADM, INCY, NUE"
2017-12,"SJM, CHD, CMI, DOV, BXP, JBHT, TER, POOL, SNA, NTRS, HOLX, STT, VMC, ROK, GL, NUE, ADM, HBAN, CINF, ROL, AFL, AVY, APD, FRT, LNC","SWK, BRO, DHI, PPG, EMN, COO, FE, AEE, PNW, ATO, DTE, CMS, INCY, ED, AOS, FDS, ROP, EIX, IEX, MHK, ESS, RHI, MAA, TTWO, BAX"
2018-01,"TER, AOS, IEX, ROP, EMN, LNC, FE, AVY, ADM, CMI, ROL, NUE, NTRS, VMC, DOV, JBHT, POOL, RHI, FDS, CINF, APD, SJM, TTWO, STT, COO","HBAN, BAX, BRO, MHK, PPG, AFL, ROK, GL, FRT, PNW, ED, CMS, MAA, INCY, BXP, DHI, ATO, AEE, ESS, DTE, CHD, SWK, SNA, EIX, HOLX"
2018-02,"POOL, EMN, ROL, FDS, AFL, CHD, NTRS, BRO, MAA, HOLX, ROK, LNC, SNA, ED, BAX, GL, COO, DOV, FRT, INCY, PPG, CMS, DTE, APD, IEX","SWK, AEE, ESS, BXP, AVY, STT, AOS, ADM, EIX, CINF, HBAN, ATO, PNW, NUE, MHK, DHI, VMC, TTWO, CMI, JBHT, ROP, FE, RHI, TER, SJM"
2018-03,"CMS, ESS, FE, MAA, POOL, ATO, ADM, EIX, ED, DHI, EMN, AEE, IEX, PNW, BXP, DTE, CHD, ROP, RHI, FRT, ROL, TER, SNA, NUE, STT","LNC, BAX, HBAN, HOLX, SWK, ROK, MHK, BRO, CMI, VMC, NTRS, INCY, TTWO, AVY, FDS, DOV, GL, SJM, APD, JBHT, AFL, AOS, COO, CINF, PPG"
