Date,Top Performers,Bottom Performers
2002-02,"EMN, SJM, AVY, DHI, GL, IEX, SNA, ATO, PPG, HBAN, CHD, APD, POOL, CINF, VMC, DOV, FRT, BXP, PNW, ROK, ESS, EIX, MHK, SWK, TER","CMI, MAA, DTE, COO, BRO, TTWO, NTRS, AOS, ROP, STT, NUE, AEE, CMS, INCY, HOLX, JBHT, FDS, AFL, FE, RHI, ADM, BAX, ED, ROL, LNC"
2002-03,"ESS, DTE, STT, CINF, INCY, TTWO, PPG, BAX, ATO, HBAN, APD, ROP, EIX, ROL, POOL, CMS, AEE, BXP, ED, DOV, IEX, JBHT, HOLX, ROK, FDS","TER, AFL, CMI, NUE, RHI, PNW, NTRS, AOS, EMN, FRT, MAA, ADM, GL, COO, SWK, DHI, AVY, FE, MHK, CHD, SJM, BRO, VMC, LNC, SNA"
2002-04,"EIX, CINF, MHK, ROK, FRT, BRO, AVY, HOLX, ED, HBAN, TTWO, AOS, SJM, DHI, MAA, COO, GL, ATO, AFL, ESS, POOL, DTE, SWK, BXP, DOV","EMN, NUE, JBHT, ROP, STT, SNA, APD, LNC, ADM, PPG, BAX, ROL, INCY, FE, PNW, VMC, CHD, IEX, TER, CMS, FDS, NTRS, RHI, CMI, AEE"
2002-05,"ADM, PPG, AFL, BRO, IEX, BXP, EMN, AEE, APD, JBHT, VMC, FE, ROL, DTE, CHD, EIX, TTWO, ROK, NUE, AVY, MHK, FRT, HOLX, ED, ESS","STT, SWK, POOL, PNW, CMS, FDS, RHI, LNC, COO, BAX, DHI, DOV, SJM, AOS, ATO, CINF, NTRS, TER, ROP, CMI, INCY, HBAN, GL, MAA, SNA"
2002-06,"PPG, JBHT, DHI, ESS, AOS, SJM, MAA, ATO, CINF, EMN, FRT, APD, CHD, CMI, EIX, FDS, ROK, VMC, LNC, MHK, COO, RHI, GL, SNA, POOL","DTE, ROP, AVY, CMS, STT, ED, SWK, HBAN, BXP, ROL, NUE, FE, TTWO, BAX, NTRS, TER, HOLX, ADM, IEX, BRO, AEE, PNW, DOV, INCY, AFL"
2002-07,"AEE, ED, HBAN, TTWO, FRT, ROL, ATO, NTRS, BRO, ADM, SNA, AOS, FE, VMC, ROK, PPG, DTE, IEX, COO, ESS, BXP, GL, STT, EMN, TER","MAA, CMS, EIX, MHK, ROP, CMI, SJM, DOV, INCY, DHI, RHI, PNW, NUE, CINF, LNC, FDS, SWK, APD, HOLX, JBHT, CHD, POOL, BAX, AFL, AVY"
2002-08,"SJM, FE, NTRS, AOS, APD, DTE, MHK, ADM, SNA, ESS, COO, GL, CMS, TTWO, HBAN, ROP, CHD, POOL, STT, LNC, BRO, BXP, AVY, EMN, ATO","AEE, IEX, MAA, BAX, EIX, CMI, DHI, ED, FDS, VMC, SWK, ROL, AFL, DOV, PPG, HOLX, TER, RHI, NUE, JBHT, INCY, FRT, CINF, PNW, ROK"
2002-09,"FDS, CHD, ADM, BRO, COO, TTWO, ATO, SJM, AFL, MHK, AVY, HOLX, FE, RHI, IEX, GL, VMC, AOS, ESS, SWK, AEE, DTE, NUE, INCY, TER","CMS, PPG, CMI, ROL, SNA, LNC, PNW, EIX, BAX, EMN, NTRS, DOV, ROK, STT, APD, CINF, DHI, HBAN, BXP, MAA, POOL, ROP, JBHT, FRT, ED"
2002-10,"AVY, ADM, FE, MHK, CINF, STT, INCY, ED, APD, RHI, IEX, PPG, HBAN, GL, CHD, POOL, DHI, TER, HOLX, ROL, FDS, PNW, ATO, JBHT, SNA","DTE, ROP, NUE, ROK, CMI, BRO, COO, EIX, NTRS, VMC, MAA, EMN, AOS, CMS, ESS, BXP, BAX, TTWO, AEE, DOV, SWK, AFL, FRT, SJM, LNC"
2002-11,"ROP, STT, INCY, MAA, EMN, ESS, SJM, PPG, COO, TER, CMI, GL, BXP, FRT, AVY, HBAN, BAX, ROK, CMS, DOV, AOS, AEE, NUE, RHI, LNC","TTWO, MHK, SNA, PNW, IEX, BRO, FDS, VMC, HOLX, NTRS, SWK, POOL, EIX, ATO, AFL, CINF, ED, FE, ADM, CHD, DTE, ROL, JBHT, DHI, APD"
2002-12,"ROL, ED, EIX, JBHT, PNW, ATO, FE, DTE, FRT, SJM, AOS, CHD, PPG, AEE, CMI, NTRS, DHI, FDS, MHK, POOL, ADM, EMN, BRO, DOV, SNA","AVY, HBAN, IEX, APD, SWK, CMS, TTWO, TER, CINF, AFL, RHI, NUE, INCY, STT, ROP, BAX, HOLX, COO, LNC, MAA, GL, ROK, BXP, ESS, VMC"
2003-01,"DHI, AFL, EIX, BAX, COO, HBAN, LNC, ROL, ROK, STT, FRT, ESS, SJM, TTWO, SNA, VMC, DTE, PNW, BRO, MHK, ED, RHI, EMN, JBHT, FE","POOL, CMS, ROP, INCY, CINF, CHD, ATO, AEE, FDS, AOS, NUE, SWK, TER, ADM, MAA, PPG, APD, NTRS, HOLX, CMI, IEX, DOV, AVY, GL, BXP"
2003-02,"ROL, FRT, NUE, BXP, CHD, COO, TER, GL, HBAN, ESS, BAX, MAA, EIX, ADM, STT, VMC, APD, MHK, NTRS, EMN, FDS, FE, ATO, PPG, IEX","DHI, AVY, AFL, BRO, SWK, CMI, HOLX, INCY, CMS, DOV, ED, SNA, ROP, SJM, RHI, LNC, JBHT, TTWO, POOL, DTE, CINF, AEE, PNW, AOS, ROK"
2003-03,"JBHT, ROL, BRO, PNW, POOL, FE, APD, TTWO, DHI, IEX, AOS, FRT, FDS, CMI, COO, AFL, SJM, ESS, AVY, CHD, HOLX, EIX, BXP, MAA, ATO","TER, AEE, ROK, NUE, SWK, DTE, NTRS, DOV, VMC, BAX, HBAN, MHK, CMS, PPG, STT, INCY, EMN, GL, LNC, CINF, RHI, ADM, ROP, ED, SNA"
2003-04,"IEX, MAA, GL, PPG, NUE, FDS, ATO, FE, EMN, ESS, AEE, EIX, ROP, CINF, DTE, HBAN, ROL, CMS, BXP, HOLX, APD, SJM, CHD, FRT, JBHT","DHI, BAX, RHI, ADM, DOV, SNA, NTRS, MHK, VMC, INCY, BRO, LNC, AOS, STT, POOL, CMI, ROK, AFL, SWK, ED, TTWO, AVY, COO, TER, PNW"
2003-05,"STT, FE, IEX, NTRS, ATO, ADM, JBHT, DTE, AOS, EMN, FRT, BXP, HBAN, DOV, TER, INCY, VMC, AVY, MAA, RHI, HOLX, MHK, SJM, ROK, ESS","SNA, CMS, CMI, COO, ROP, NUE, SWK, PNW, TTWO, EIX, AEE, DHI, FDS, ED, BAX, LNC, APD, CHD, CINF, AFL, PPG, POOL, ROL, BRO, GL"
2003-06,"NTRS, ADM, DHI, POOL, SJM, CMI, FE, PPG, IEX, HOLX, BXP, CHD, MAA, STT, BAX, JBHT, NUE, LNC, CMS, ED, FDS, TTWO, RHI, VMC, ROK","ATO, ROP, TER, EIX, COO, ESS, AVY, ROL, BRO, AFL, HBAN, APD, MHK, SNA, GL, INCY, EMN, AEE, FRT, AOS, DTE, PNW, DOV, SWK, CINF"
2003-07,"GL, VMC, ROK, AVY, INCY, ESS, ROP, HOLX, CINF, BAX, MAA, HBAN, NTRS, LNC, FDS, AFL, CMI, JBHT, DOV, MHK, SWK, ADM, IEX, AOS, STT","EMN, RHI, POOL, APD, PPG, FRT, NUE, COO, SJM, BXP, DHI, PNW, ED, DTE, TTWO, TER, BRO, AEE, SNA, CMS, FE, ATO, CHD, ROL, EIX"
2003-08,"TER, MHK, AOS, CMI, ROP, SWK, COO, POOL, JBHT, ADM, FDS, ROK, IEX, MAA, NUE, SNA, DOV, ESS, VMC, CINF, CMS, RHI, HOLX, EIX, TTWO","DHI, APD, AEE, BAX, AVY, PNW, SJM, FRT, LNC, ROL, STT, NTRS, INCY, PPG, HBAN, DTE, FE, CHD, EMN, BXP, GL, ED, AFL, ATO, BRO"
2003-09,"COO, CHD, DTE, JBHT, FRT, DHI, SJM, ED, TER, PNW, BAX, MAA, STT, INCY, TTWO, CMS, FE, ROP, POOL, EIX, BXP, AFL, AEE, GL, NTRS","FDS, AVY, DOV, EMN, IEX, SNA, ADM, APD, PPG, VMC, ROK, AOS, MHK, HOLX, RHI, NUE, CMI, SWK, CINF, HBAN, BRO, ATO, ESS, ROL, LNC"
2003-10,"HBAN, ADM, GL, FE, CMI, COO, CHD, SNA, AEE, FRT, AVY, MAA, MHK, SJM, BXP, EIX, CINF, POOL, TER, DHI, RHI, PNW, ATO, NUE, ROK","STT, TTWO, INCY, ROL, ROP, AOS, AFL, SWK, LNC, VMC, PPG, DOV, NTRS, CMS, IEX, DTE, APD, BAX, ESS, JBHT, EMN, FDS, BRO, ED, HOLX"
2003-11,"DHI, EMN, ROL, PNW, CHD, ROK, ESS, MAA, IEX, APD, COO, SJM, AVY, BAX, BXP, EIX, FRT, JBHT, BRO, NUE, SNA, DTE, POOL, INCY, AOS","HOLX, TER, HBAN, ROP, PPG, GL, FE, ATO, VMC, RHI, FDS, NTRS, CMS, MHK, STT, CMI, TTWO, SWK, DOV, AFL, AEE, LNC, CINF, ADM, ED"
2003-12,"BAX, SNA, ED, CMS, ROK, VMC, EIX, ADM, CMI, IEX, RHI, DTE, AEE, BXP, DOV, BRO, GL, COO, NTRS, LNC, JBHT, FE, CINF, HBAN, STT","MAA, SWK, HOLX, INCY, EMN, PPG, APD, AVY, PNW, ROL, TER, AFL, ESS, POOL, FDS, FRT, MHK, CHD, TTWO, ROP, DHI, SJM, AOS, NUE, ATO"
2004-01,"LNC, FRT, FE, AEE, BRO, TER, ATO, BXP, CINF, GL, INCY, DOV, STT, CMI, CMS, NTRS, ADM, SJM, MAA, COO, EMN, ROL, AVY, AFL, ED","HOLX, NUE, RHI, CHD, TTWO, DTE, EIX, VMC, IEX, PPG, ROK, APD, SNA, JBHT, DHI, BAX, ESS, POOL, AOS, PNW, ROP, MHK, FDS, SWK, HBAN"
2004-02,"ADM, SJM, TTWO, BRO, EMN, LNC, EIX, MAA, CMS, NTRS, CHD, JBHT, CINF, HBAN, DTE, FE, ATO, SNA, FRT, IEX, BXP, SWK, MHK, HOLX, DHI","POOL, NUE, GL, AFL, AVY, ESS, PPG, ED, PNW, ROP, AOS, TER, ROL, ROK, DOV, RHI, APD, FDS, INCY, CMI, COO, AEE, VMC, STT, BAX"
2004-03,"FRT, BAX, BXP, BRO, EIX, RHI, SJM, CHD, ESS, APD, MAA, GL, JBHT, POOL, FE, CMI, TTWO, FDS, ROK, COO, DHI, ROL, SWK, IEX, LNC","SNA, DTE, HOLX, ED, VMC, EMN, PNW, AOS, NTRS, HBAN, INCY, CINF, TER, STT, AEE, CMS, NUE, ATO, AVY, ADM, MHK, AFL, DOV, ROP, PPG"
2004-04,"IEX, POOL, AFL, SNA, ADM, AVY, CHD, AOS, DOV, BAX, CMI, RHI, JBHT, PPG, EMN, BRO, ROP, SWK, NTRS, ROL, CMS, FDS, ED, MHK, STT","ESS, ROK, LNC, INCY, DTE, AEE, ATO, GL, NUE, TTWO, EIX, VMC, HBAN, FRT, DHI, TER, MAA, BXP, SJM, PNW, CINF, HOLX, APD, COO, FE"
2004-05,"FDS, TER, ROP, EMN, FRT, ESS, LNC, HBAN, BXP, CINF, PNW, GL, CMS, ROK, JBHT, EIX, TTWO, DTE, ROL, RHI, BRO, SWK, COO, MAA, NUE","HOLX, NTRS, IEX, AEE, CHD, PPG, ATO, DHI, APD, POOL, INCY, AVY, SJM, ADM, ED, AFL, MHK, VMC, DOV, CMI, AOS, STT, BAX, SNA, FE"
2004-06,"BAX, AVY, DOV, FDS, IEX, BRO, AOS, CMI, ROP, MAA, VMC, RHI, INCY, EIX, CMS, PPG, APD, SWK, ATO, ESS, FRT, TTWO, ED, JBHT, NUE","COO, HOLX, POOL, ROK, TER, CINF, BXP, ADM, STT, CHD, HBAN, DTE, AFL, SNA, PNW, SJM, ROL, FE, AEE, NTRS, DHI, MHK, GL, LNC, EMN"
2004-07,"NUE, HBAN, BXP, EIX, AEE, FE, ED, FRT, CMI, TTWO, ROL, DTE, MHK, PNW, VMC, AOS, SJM, FDS, POOL, ADM, CINF, LNC, IEX, RHI, SWK","COO, DOV, PPG, MAA, AVY, NTRS, SNA, CHD, TER, AFL, DHI, GL, ESS, EMN, INCY, HOLX, BAX, STT, ATO, ROP, BRO, CMS, APD, JBHT, ROK"
2004-08,"SJM, FRT, NTRS, CMS, BRO, STT, PNW, BXP, TTWO, AEE, MHK, LNC, ROK, EMN, ADM, FDS, ED, FE, DTE, AVY, POOL, MAA, DHI, ESS, INCY","SWK, CHD, BAX, PPG, APD, CINF, AFL, HBAN, ROL, ATO, EIX, HOLX, NUE, DOV, IEX, CMI, TER, COO, AOS, RHI, JBHT, GL, ROP, SNA, VMC"
2004-09,"JBHT, FDS, VMC, DHI, ADM, AVY, RHI, BAX, INCY, ROL, ROP, TER, HOLX, APD, LNC, DOV, PPG, GL, MHK, FE, EMN, CINF, DTE, COO, NUE","IEX, CMI, BRO, ED, HBAN, ATO, TTWO, CHD, STT, NTRS, POOL, FRT, SJM, ESS, AFL, SNA, MAA, SWK, PNW, EIX, AEE, CMS, ROK, AOS, BXP"
2004-10,"JBHT, POOL, BXP, FRT, AOS, IEX, ROL, INCY, ROK, ROP, MHK, SNA, STT, AEE, SWK, NTRS, HOLX, PPG, FDS, ED, TER, RHI, PNW, COO, DTE","ATO, EIX, ADM, ESS, CINF, GL, DOV, MAA, EMN, FE, TTWO, SJM, DHI, BRO, AFL, AVY, NUE, LNC, CMI, BAX, HBAN, CHD, VMC, CMS, APD"
2004-11,"ADM, CMS, IEX, POOL, APD, SNA, CINF, TTWO, LNC, PPG, FRT, SWK, PNW, AFL, EIX, ATO, VMC, FDS, NUE, HOLX, MHK, TER, DOV, BAX, DTE","ESS, SJM, FE, DHI, CHD, EMN, AOS, CMI, ROK, NTRS, RHI, GL, MAA, HBAN, ED, AEE, BXP, ROL, AVY, BRO, JBHT, INCY, COO, STT, ROP"
2004-12,"HOLX, SNA, BAX, RHI, CHD, BRO, BXP, ROL, AFL, EMN, VMC, CMI, ADM, SWK, ROK, MAA, DOV, GL, ESS, MHK, SJM, AEE, NTRS, FRT, AVY","ATO, CMS, DHI, FDS, JBHT, STT, HBAN, PPG, COO, LNC, POOL, APD, IEX, ED, PNW, EIX, FE, INCY, DTE, ROP, CINF, NUE, TTWO, AOS, TER"
2005-01,"COO, ADM, NUE, VMC, HOLX, RHI, DTE, CHD, EIX, ROK, APD, TTWO, AEE, ATO, PPG, CMS, FE, CINF, ED, AVY, NTRS, BXP, AOS, DOV, FDS","STT, MAA, FRT, CMI, POOL, HBAN, PNW, ROL, EMN, IEX, ROP, GL, SNA, MHK, SWK, TER, ESS, INCY, JBHT, DHI, LNC, SJM, AFL, BRO, BAX"
2005-02,"TER, ROK, BRO, COO, JBHT, EMN, FRT, APD, BAX, SJM, PPG, TTWO, FE, BXP, HOLX, ROL, IEX, CHD, AEE, VMC, LNC, CMS, POOL, ROP, NUE","DHI, MHK, CINF, PNW, AVY, DOV, DTE, MAA, ESS, FDS, CMI, GL, RHI, NTRS, AFL, SWK, INCY, ED, AOS, STT, HBAN, ATO, ADM, SNA, EIX"
2005-03,"AOS, ROL, CMS, EIX, TTWO, HBAN, SJM, DTE, NTRS, FE, AVY, ADM, EMN, IEX, PNW, ROP, APD, BXP, CHD, FDS, ROK, NUE, RHI, JBHT, POOL","MHK, TER, AEE, BAX, ESS, CMI, FRT, LNC, SNA, MAA, INCY, AFL, CINF, SWK, DOV, HOLX, COO, DHI, VMC, ATO, BRO, STT, ED, PPG, GL"
2005-04,"BAX, AFL, AEE, STT, ROL, EIX, MAA, SNA, DHI, NTRS, FE, ROP, ED, GL, POOL, FRT, HOLX, BXP, ESS, DTE, CHD, TTWO, RHI, EMN, MHK","IEX, COO, APD, VMC, PPG, BRO, SWK, INCY, DOV, CMI, ADM, TER, CINF, ATO, ROK, FDS, AVY, NUE, JBHT, PNW, SJM, AOS, CMS, HBAN, LNC"
2005-05,"POOL, TTWO, EMN, MAA, ATO, MHK, PNW, AEE, ESS, ED, DOV, SNA, STT, SWK, NUE, DTE, ROP, HOLX, IEX, ROL, FRT, JBHT, APD, CMS, NTRS","TER, INCY, FDS, DHI, VMC, ROK, AOS, ADM, AFL, LNC, BRO, FE, EIX, BXP, RHI, CHD, SJM, PPG, COO, CINF, GL, HBAN, BAX, CMI, AVY"
2005-06,"FE, DHI, VMC, ADM, HOLX, FRT, BXP, AFL, ED, ESS, HBAN, LNC, ATO, CMS, MAA, FDS, EIX, CMI, ROP, SWK, AVY, AEE, BRO, PNW, BAX","IEX, STT, RHI, CHD, TER, COO, INCY, EMN, SJM, ROK, JBHT, DOV, PPG, POOL, AOS, NUE, DTE, ROL, TTWO, MHK, GL, NTRS, APD, SNA, CINF"
2005-07,"BXP, DHI, SWK, VMC, ROP, ADM, AVY, SNA, MHK, MAA, BAX, ROK, CMS, CINF, HBAN, ROL, RHI, AFL, POOL, CHD, PPG, STT, FE, TER, NUE","PNW, LNC, ED, FDS, HOLX, CMI, DOV, IEX, COO, NTRS, FRT, ESS, INCY, JBHT, AEE, DTE, EIX, SJM, ATO, EMN, AOS, BRO, TTWO, APD, GL"
2005-08,"EIX, BRO, TER, HOLX, AOS, BAX, LNC, FE, VMC, NUE, CMS, CHD, ATO, CMI, GL, ROK, ROP, POOL, SJM, JBHT, INCY, APD, BXP, SWK, ROL","MAA, AVY, FRT, FDS, ESS, AFL, HBAN, TTWO, SNA, PPG, STT, MHK, DTE, ED, NTRS, ADM, EMN, DHI, DOV, AEE, PNW, CINF, RHI, COO, IEX"
2005-09,"ADM, RHI, JBHT, AFL, EIX, LNC, BRO, ED, NUE, MAA, VMC, FE, SNA, CINF, ESS, SJM, HOLX, COO, CMS, CMI, ROK, SWK, ROP, NTRS, AOS","STT, FDS, DOV, TTWO, HBAN, MHK, PPG, POOL, INCY, ATO, CHD, AEE, IEX, EMN, AVY, PNW, TER, DHI, FRT, BAX, APD, ROL, BXP, GL, DTE"
2005-10,"BRO, AVY, NTRS, INCY, AFL, HBAN, APD, RHI, SWK, POOL, CINF, AOS, EMN, STT, NUE, BXP, JBHT, PPG, ESS, FRT, ROK, MAA, CMS, FE, EIX","ATO, TTWO, ED, IEX, SJM, PNW, CHD, DTE, DOV, BAX, ROP, HOLX, CMI, MHK, LNC, ROL, TER, DHI, VMC, COO, ADM, AEE, FDS, SNA, GL"
2005-11,"BXP, POOL, TER, BRO, ROL, ROK, MAA, EMN, ROP, CINF, STT, CMI, FRT, AVY, DOV, SNA, RHI, LNC, APD, HOLX, EIX, HBAN, GL, VMC, DHI","JBHT, AOS, MHK, NUE, INCY, IEX, FDS, ESS, BAX, PPG, ATO, DTE, PNW, AFL, CMS, CHD, ADM, COO, NTRS, TTWO, FE, SJM, AEE, ED, SWK"
2005-12,"HOLX, FDS, FE, ROK, ADM, BRO, CMS, ED, GL, LNC, VMC, JBHT, SNA, CMI, DHI, ESS, DOV, CINF, IEX, EMN, COO, AVY, POOL, INCY, PPG","STT, AOS, FRT, EIX, AFL, BAX, TTWO, ROL, SJM, AEE, NTRS, BXP, MHK, DTE, HBAN, RHI, NUE, TER, CHD, ATO, PNW, MAA, APD, SWK, ROP"
2006-01,"STT, ROL, AVY, ESS, CMI, COO, POOL, SNA, BXP, VMC, MAA, JBHT, APD, DHI, HOLX, ADM, NUE, AOS, PNW, LNC, PPG, SWK, CINF, TER, DOV","IEX, ROK, CHD, FRT, FE, ROP, ED, NTRS, AFL, EIX, GL, ATO, BRO, EMN, INCY, RHI, FDS, MHK, TTWO, HBAN, DTE, SJM, BAX, CMS, AEE"
2006-02,"VMC, POOL, BRO, BXP, AOS, MAA, LNC, DOV, FRT, APD, HBAN, STT, ROK, IEX, BAX, DTE, INCY, ROP, CMI, EMN, SWK, NUE, FE, PPG, MHK","EIX, NTRS, ADM, ATO, AVY, SJM, DHI, HOLX, CHD, COO, TER, SNA, CMS, CINF, PNW, ED, GL, FDS, TTWO, RHI, ROL, AFL, JBHT, AEE, ESS"
2006-03,"VMC, BXP, ESS, POOL, FRT, ROP, RHI, CHD, ADM, BRO, ROK, PPG, ROL, APD, GL, EMN, NUE, COO, BAX, INCY, TTWO, HOLX, AOS, FDS, IEX","DOV, SJM, SWK, ATO, MAA, JBHT, CMS, TER, DTE, EIX, MHK, CINF, PNW, ED, LNC, FE, STT, CMI, DHI, AFL, AVY, AEE, SNA, NTRS, HBAN"
2006-04,"RHI, SNA, TER, STT, ADM, EMN, AVY, LNC, PPG, AFL, GL, NUE, SWK, FE, DTE, CMS, PNW, APD, DOV, AEE, NTRS, JBHT, CINF, COO, HBAN","ESS, ATO, ROK, DHI, TTWO, FRT, BRO, BXP, INCY, MAA, BAX, IEX, ROP, VMC, HOLX, AOS, EIX, SJM, ED, MHK, CHD, CMI, FDS, POOL, ROL"
2006-05,"CINF, SJM, CMI, EMN, FE, JBHT, ADM, ED, FDS, ATO, SNA, VMC, MHK, TER, POOL, SWK, AOS, ROK, APD, NTRS, AVY, STT, IEX, TTWO, PPG","BXP, CMS, MAA, NUE, RHI, EIX, ROL, LNC, HBAN, BRO, ESS, GL, DOV, AEE, HOLX, COO, DHI, AFL, CHD, ROP, DTE, PNW, BAX, INCY, FRT"
2006-06,"INCY, SJM, BXP, ROK, AOS, FDS, ATO, ESS, FE, HOLX, PPG, GL, NUE, CINF, RHI, CMI, MAA, FRT, ED, AEE, JBHT, DOV, PNW, POOL, CHD","DTE, CMS, LNC, VMC, DHI, COO, STT, MHK, EMN, BRO, TTWO, SNA, SWK, BAX, IEX, AVY, TER, APD, NTRS, AFL, EIX, ADM, ROP, ROL, HBAN"
2006-07,"BXP, CMS, PNW, ROL, BRO, EIX, ADM, ESS, ED, DTE, FRT, HBAN, SNA, STT, NTRS, FE, AEE, ATO, MAA, BAX, AVY, CINF, APD, LNC, HOLX","IEX, AOS, INCY, EMN, FDS, PPG, TER, AFL, DOV, CMI, SWK, ROP, RHI, MHK, JBHT, VMC, ROK, POOL, DHI, TTWO, NUE, GL, SJM, COO, CHD"
2006-08,"SJM, PNW, LNC, ESS, MAA, TER, EMN, BAX, AVY, CHD, EIX, CMS, SWK, SNA, AEE, APD, BXP, DOV, GL, PPG, STT, ROP, MHK, INCY, VMC","TTWO, COO, DHI, AFL, FRT, FE, ROL, FDS, ROK, NUE, ADM, AOS, BRO, RHI, JBHT, HOLX, IEX, POOL, NTRS, CMI, HBAN, ED, DTE, CINF, ATO"
2006-09,"FDS, RHI, DHI, COO, PPG, JBHT, SWK, MHK, NTRS, CMI, ROK, CINF, EMN, SNA, IEX, BAX, TTWO, LNC, BRO, AFL, CHD, BXP, GL, POOL, MAA","ED, NUE, STT, HOLX, ADM, TER, EIX, ROP, ESS, AVY, DOV, PNW, AOS, INCY, AEE, CMS, FE, SJM, DTE, ROL, VMC, HBAN, APD, ATO, FRT"
2006-10,"IEX, FRT, COO, ATO, RHI, EIX, ROP, ROK, TER, CMI, POOL, PNW, AVY, SNA, APD, FE, FDS, ED, JBHT, VMC, BXP, MAA, CHD, AEE, STT","CMS, HBAN, ROL, NUE, EMN, INCY, DTE, HOLX, ESS, SJM, LNC, PPG, ADM, BAX, NTRS, CINF, BRO, SWK, MHK, GL, DHI, TTWO, AFL, AOS, DOV"
2006-11,"INCY, BXP, VMC, CMS, ROP, SWK, AVY, ATO, MHK, TER, FRT, DOV, RHI, ROK, PNW, HOLX, FDS, DTE, EIX, TTWO, CHD, GL, IEX, NUE, DHI","AOS, FE, ROL, AEE, JBHT, LNC, SNA, ADM, COO, PPG, CMI, MAA, STT, NTRS, CINF, BAX, EMN, SJM, AFL, ESS, BRO, APD, HBAN, ED, POOL"
2006-12,"STT, FDS, NTRS, AOS, AFL, LNC, BAX, CMS, DTE, PNW, INCY, TTWO, CINF, CHD, VMC, APD, FE, SJM, ROL, ED, SNA, GL, AVY, PPG, TER","ADM, NUE, ROK, HOLX, JBHT, MAA, BXP, POOL, RHI, MHK, BRO, HBAN, DOV, ESS, ROP, AEE, ATO, COO, SWK, CMI, IEX, EIX, DHI, FRT, EMN"
2007-01,"MHK, DHI, RHI, IEX, BAX, COO, APD, CHD, STT, MAA, AFL, INCY, JBHT, ROP, PPG, FDS, NUE, BXP, HOLX, SWK, CMI, VMC, ESS, FRT, AOS","GL, AVY, SNA, DOV, LNC, NTRS, ED, POOL, PNW, DTE, TTWO, ATO, SJM, FE, ROL, HBAN, CINF, EMN, EIX, TER, CMS, AEE, ADM, ROK, BRO"
2007-02,"TER, ADM, MHK, CHD, JBHT, FE, ROL, FDS, CMS, EIX, SJM, SNA, ROP, TTWO, VMC, LNC, ROK, AOS, EMN, BAX, ATO, ED, IEX, STT, MAA","NUE, BXP, POOL, RHI, ESS, COO, DOV, CINF, FRT, SWK, AVY, PNW, AEE, INCY, DHI, GL, AFL, NTRS, HOLX, BRO, HBAN, DTE, PPG, CMI, APD"
2007-03,"SJM, CMI, EMN, ADM, NUE, PPG, FE, ED, COO, BAX, CHD, HOLX, EIX, DTE, FDS, ROP, INCY, TER, GL, DOV, TTWO, CMS, POOL, MAA, PNW","ESS, MHK, HBAN, RHI, BRO, AEE, SNA, AVY, ROK, BXP, IEX, CINF, DHI, STT, APD, AOS, JBHT, LNC, SWK, NTRS, AFL, FRT, VMC, ROL, ATO"
2007-04,"MHK, AFL, BAX, EMN, CINF, EIX, DTE, STT, VMC, SWK, AEE, TER, ADM, NTRS, COO, LNC, SJM, PPG, GL, CMS, APD, CMI, FE, JBHT, IEX","HBAN, INCY, SNA, POOL, ROP, ATO, DHI, CHD, BXP, TTWO, BRO, MAA, AVY, FDS, NUE, RHI, DOV, ROK, AOS, HOLX, PNW, FRT, ESS, ROL, ED"
2007-05,"MAA, SWK, IEX, COO, JBHT, TTWO, NUE, RHI, DHI, AVY, DTE, ROP, DOV, FDS, AOS, PPG, NTRS, SJM, AFL, GL, LNC, ROK, MHK, EIX, CMI","ATO, POOL, APD, HBAN, BRO, FE, AEE, ADM, INCY, HOLX, ED, VMC, PNW, TER, EMN, FRT, BXP, CMS, CHD, ESS, STT, SNA, ROL, BAX, CINF"
2007-06,"CMI, FDS, RHI, TER, APD, DOV, ROK, SJM, HOLX, IEX, AVY, AOS, HBAN, JBHT, PPG, DTE, ESS, AEE, ED, ATO, SNA, FE, CMS, ADM, CINF","GL, POOL, SWK, VMC, EIX, BRO, COO, TTWO, CHD, EMN, AFL, ROP, LNC, INCY, PNW, DHI, NUE, FRT, BXP, MAA, NTRS, MHK, ROL, BAX, STT"
2007-07,"APD, EMN, ROP, ROL, SNA, AOS, CMI, BRO, ADM, AFL, CHD, ROK, CINF, SWK, GL, AVY, RHI, BXP, ESS, ATO, BAX, HOLX, FE, IEX, CMS","PNW, COO, EIX, JBHT, FDS, ED, DTE, NTRS, FRT, STT, DHI, VMC, LNC, HBAN, MAA, POOL, NUE, SJM, TTWO, INCY, TER, MHK, AEE, DOV, PPG"
2007-08,"INCY, ESS, PNW, CINF, IEX, BXP, AEE, ROP, NUE, ED, BRO, APD, BAX, JBHT, DTE, HOLX, SWK, FRT, ROL, MAA, AFL, LNC, FE, CMS, ROK","TTWO, FDS, STT, CHD, DHI, SNA, RHI, VMC, TER, PPG, DOV, MHK, EMN, POOL, COO, AVY, NTRS, HBAN, SJM, AOS, EIX, CMI, ATO, GL, ADM"
2007-09,"APD, LNC, CMI, NTRS, COO, AFL, TTWO, FRT, EIX, CHD, FE, BXP, PPG, DOV, ROP, AEE, CMS, INCY, BAX, CINF, HOLX, FDS, NUE, STT, ED","ATO, SNA, DTE, GL, ROL, MAA, AOS, JBHT, TER, MHK, RHI, IEX, AVY, POOL, SJM, BRO, DHI, ADM, HBAN, SWK, ROK, PNW, VMC, ESS, EMN"
2007-10,"AFL, FE, TTWO, ADM, ROP, HBAN, BAX, ESS, EIX, JBHT, NUE, MHK, BXP, GL, MAA, AEE, DTE, INCY, SWK, FDS, STT, NTRS, ROL, HOLX, PNW","ED, AVY, CMS, RHI, SNA, CHD, APD, EMN, CINF, CMI, POOL, LNC, BRO, VMC, COO, IEX, AOS, TER, DOV, PPG, ATO, DHI, ROK, SJM, FRT"
2007-11,"NTRS, PNW, VMC, ED, CMS, COO, CHD, ADM, APD, IEX, DOV, CINF, POOL, SWK, BXP, PPG, SJM, ATO, MAA, MHK, FRT, DHI, JBHT, GL, AOS","NUE, EIX, EMN, ROL, TTWO, CMI, BRO, HOLX, SNA, ESS, HBAN, TER, FDS, RHI, ROP, AVY, FE, ROK, DTE, INCY, LNC, AEE, BAX, AFL, STT"
2007-12,"CMI, ATO, FE, SJM, JBHT, HOLX, ADM, TTWO, PPG, INCY, DHI, ED, ROK, AVY, STT, IEX, RHI, AEE, AFL, MHK, SWK, BXP, POOL, ESS, HBAN","NTRS, LNC, TER, EMN, EIX, BRO, CHD, BAX, ROL, GL, COO, MAA, FDS, VMC, DTE, ROP, FRT, CINF, PNW, AOS, SNA, APD, CMS, NUE, DOV"
2008-01,"EMN, MHK, ESS, MAA, BXP, SWK, TER, BAX, DHI, COO, POOL, RHI, ATO, INCY, JBHT, SNA, STT, GL, FDS, PNW, FRT, SJM, APD, ROL, HBAN","PPG, LNC, HOLX, ADM, BRO, NTRS, CMI, AFL, EIX, DTE, AVY, ROK, AEE, IEX, DOV, TTWO, ED, ROP, CMS, CINF, CHD, FE, NUE, VMC, AOS"
2008-02,"SJM, TER, MAA, TTWO, AOS, CMI, DOV, ADM, AFL, NUE, APD, SNA, ESS, ROP, CHD, ATO, HBAN, CMS, NTRS, DTE, HOLX, ED, FDS, BXP, PNW","SWK, PPG, FE, EIX, LNC, AEE, STT, ROK, CINF, IEX, RHI, FRT, POOL, BRO, BAX, DHI, INCY, COO, JBHT, MHK, VMC, GL, AVY, EMN, ROL"
2008-03,"FRT, ESS, BXP, INCY, ROK, ROP, NUE, AFL, TER, AEE, MAA, FDS, SNA, CINF, FE, JBHT, DHI, IEX, LNC, CHD, DOV, APD, COO, ROL, STT","MHK, AOS, ADM, HOLX, CMI, CMS, EMN, VMC, RHI, AVY, TTWO, DTE, BRO, BAX, SWK, HBAN, NTRS, PPG, ED, PNW, POOL, EIX, ATO, SJM, GL"
2008-04,"BXP, ATO, BAX, JBHT, GL, CMS, APD, EIX, ADM, TER, MHK, FRT, ESS, MAA, DTE, HOLX, ED, CHD, AEE, ROP, CMI, VMC, LNC, INCY, TTWO","AFL, IEX, EMN, DOV, SNA, POOL, NUE, NTRS, FDS, BRO, FE, SWK, COO, PPG, STT, RHI, AOS, ROK, CINF, PNW, HBAN, ROL, DHI, SJM, AVY"
2008-05,"DTE, DOV, ROK, MAA, FDS, AVY, CMS, IEX, SJM, ROP, SNA, EMN, FE, RHI, APD, TER, LNC, TTWO, PPG, JBHT, NTRS, AOS, COO, CMI, VMC","EIX, BRO, PNW, SWK, AFL, ESS, AEE, CHD, POOL, HBAN, BXP, CINF, BAX, FRT, GL, DHI, HOLX, INCY, ADM, MHK, ATO, NUE, ED, STT, ROL"
2008-06,"FE, BAX, ATO, ROP, NTRS, HOLX, AOS, PNW, MAA, PPG, COO, SWK, BXP, GL, AEE, CMI, ROL, AFL, TTWO, IEX, JBHT, DTE, ED, CMS, HBAN","EIX, APD, CINF, ROK, SJM, VMC, INCY, RHI, TER, LNC, SNA, AVY, ADM, MHK, FRT, DHI, POOL, FDS, STT, ESS, BRO, DOV, EMN, CHD, NUE"
2008-07,"PNW, SNA, BAX, BXP, VMC, FRT, PPG, RHI, LNC, POOL, HBAN, INCY, AOS, IEX, DOV, DHI, FDS, SJM, ROL, ESS, NTRS, MAA, STT, JBHT, CINF","ROK, ED, CMI, BRO, AVY, CMS, COO, MHK, ROP, EIX, ATO, APD, NUE, CHD, DTE, TER, HOLX, ADM, EMN, AFL, TTWO, FE, AEE, GL, SWK"
2008-08,"TTWO, POOL, AVY, COO, FDS, SWK, LNC, PNW, BXP, CINF, ROK, FRT, HBAN, AOS, ROL, ATO, PPG, GL, ED, DTE, NTRS, MHK, VMC, BRO, HOLX","CHD, DHI, SJM, INCY, AFL, AEE, SNA, RHI, EMN, CMS, NUE, STT, EIX, APD, ROP, ESS, MAA, ADM, CMI, IEX, FE, BAX, JBHT, DOV, TER"
2008-09,"HBAN, ROL, BRO, ED, DHI, AFL, FRT, ESS, VMC, HOLX, EMN, BXP, JBHT, CMS, SNA, FE, AVY, AEE, PPG, SJM, COO, DTE, AOS, CINF, TTWO","CMI, ROP, POOL, BAX, RHI, APD, INCY, NUE, ROK, MHK, PNW, ATO, MAA, DOV, FDS, IEX, TER, STT, LNC, ADM, EIX, SWK, NTRS, CHD, GL"
2008-10,"NUE, HBAN, ED, ATO, PNW, BAX, ROL, CINF, LNC, COO, ADM, BRO, INCY, DHI, CMI, CHD, HOLX, TER, GL, SJM, SNA, MAA, MHK, FRT, TTWO","VMC, EMN, ROK, FDS, POOL, IEX, AFL, RHI, BXP, STT, FE, NTRS, DOV, AVY, SWK, ROP, AOS, CMS, ESS, AEE, PPG, JBHT, APD, DTE, EIX"
2008-11,"AEE, MAA, DTE, AFL, AOS, ADM, FDS, ATO, TTWO, HOLX, ROK, CINF, FE, RHI, VMC, SJM, ROP, CHD, DHI, ED, EIX, DOV, FRT, JBHT, MHK","BRO, TER, BXP, SWK, STT, SNA, PNW, CMI, INCY, LNC, COO, EMN, NTRS, APD, HBAN, GL, BAX, NUE, PPG, AVY, ESS, ROL, POOL, CMS, IEX"
2008-12,"FRT, SWK, ADM, PNW, BRO, CMI, APD, POOL, AVY, IEX, ROL, ROK, MHK, LNC, BXP, NUE, GL, COO, DHI, VMC, NTRS, INCY, DOV, TER, FDS","SNA, BAX, CMS, MAA, RHI, AOS, HOLX, STT, AEE, CHD, ROP, HBAN, DTE, TTWO, EIX, SJM, EMN, ATO, JBHT, PPG, ED, FE, ESS, CINF, AFL"
2009-01,"BAX, ED, PNW, SJM, ATO, FE, EIX, CMS, COO, TER, NTRS, AEE, APD, HOLX, BRO, SWK, TTWO, HBAN, AOS, IEX, ROP, CHD, ADM, AFL, STT","GL, VMC, MHK, AVY, CINF, SNA, INCY, MAA, BXP, LNC, ROK, RHI, FRT, EMN, DHI, JBHT, DOV, ROL, ESS, POOL, PPG, NUE, CMI, FDS, DTE"
2009-02,"STT, DHI, COO, ROL, ROP, RHI, JBHT, CHD, APD, AOS, CINF, CMS, HBAN, LNC, HOLX, GL, NTRS, FDS, MHK, AEE, AFL, ROK, DTE, SNA, INCY","EMN, PNW, ADM, FRT, SJM, ESS, NUE, PPG, AVY, EIX, POOL, VMC, FE, SWK, BXP, TER, IEX, CMI, BAX, TTWO, BRO, DOV, ED, ATO, MAA"
2009-03,"ROK, ROL, SWK, VMC, CMS, NTRS, SNA, ATO, CHD, DOV, TER, EIX, ESS, ADM, TTWO, MHK, EMN, FDS, DTE, GL, CMI, STT, APD, PPG, COO","ROP, MAA, JBHT, AFL, RHI, HOLX, DHI, HBAN, NUE, IEX, BRO, FRT, CINF, ED, AVY, INCY, SJM, PNW, POOL, BAX, FE, BXP, LNC, AEE, AOS"
2009-04,"DTE, TTWO, COO, NUE, ROP, VMC, FDS, HBAN, LNC, ATO, CINF, MHK, EMN, FE, SJM, AFL, ROK, BXP, ROL, CHD, TER, SNA, RHI, POOL, DHI","CMI, SWK, AVY, PNW, AOS, FRT, BRO, MAA, PPG, APD, DOV, JBHT, IEX, HOLX, ESS, GL, STT, CMS, AEE, INCY, EIX, NTRS, ED, BAX, ADM"
2009-05,"JBHT, NUE, ESS, LNC, NTRS, BAX, HBAN, EMN, INCY, GL, STT, AFL, TER, PNW, EIX, DTE, SJM, DOV, ADM, AEE, PPG, SNA, COO, CHD, FE","ROL, IEX, VMC, SWK, CMS, CINF, ROP, TTWO, CMI, FRT, ED, AVY, DHI, AOS, ATO, ROK, POOL, BXP, MHK, HOLX, RHI, APD, FDS, BRO, MAA"
2009-06,"TTWO, CMI, PNW, AOS, CHD, CMS, EIX, ED, AEE, HBAN, DOV, DTE, ATO, ROK, ROP, IEX, ROL, FE, BRO, BAX, SJM, DHI, HOLX, RHI, STT","NUE, MAA, LNC, ESS, EMN, GL, NTRS, AVY, SNA, MHK, COO, FDS, SWK, POOL, TER, ADM, FRT, AFL, VMC, BXP, CINF, APD, JBHT, PPG, INCY"
2009-07,"CINF, DTE, CHD, ATO, MAA, CMS, BAX, STT, FE, ESS, INCY, PNW, ROL, AVY, ROP, GL, ED, MHK, POOL, RHI, EMN, AEE, EIX, HOLX, ROK","PPG, SNA, DHI, LNC, CMI, AFL, SJM, DOV, AOS, SWK, APD, TER, FDS, ADM, FRT, BXP, NTRS, IEX, COO, VMC, NUE, TTWO, JBHT, BRO, HBAN"
2009-08,"FE, GL, FRT, AFL, CINF, AEE, RHI, VMC, CMI, EMN, SNA, TER, PNW, SJM, STT, CMS, BRO, EIX, INCY, ED, LNC, DHI, AVY, ESS, BXP","MAA, HOLX, HBAN, TTWO, SWK, DOV, ROK, BAX, DTE, PPG, JBHT, POOL, APD, ATO, NUE, ADM, CHD, FDS, MHK, ROL, IEX, NTRS, AOS, ROP, COO"
2009-09,"COO, VMC, BXP, ROP, TTWO, ESS, PPG, ROL, AFL, IEX, NUE, ATO, SWK, APD, ED, HBAN, MAA, FDS, FE, LNC, EMN, ROK, INCY, SJM, AVY","JBHT, DOV, TER, GL, ADM, CINF, DTE, CMS, EIX, STT, BAX, AOS, AEE, POOL, SNA, MHK, RHI, BRO, DHI, FRT, CMI, HOLX, NTRS, CHD, PNW"
2009-10,"SWK, DTE, SNA, AOS, ADM, IEX, CHD, HOLX, TER, LNC, RHI, BXP, JBHT, GL, COO, FE, BAX, PNW, EIX, ESS, BRO, ROL, DHI, CMI, ROK","FDS, PPG, STT, AFL, MAA, FRT, DOV, AEE, TTWO, HBAN, VMC, NUE, NTRS, INCY, POOL, MHK, ATO, EMN, AVY, CINF, ROP, CMS, ED, SJM, APD"
2009-11,"FRT, DOV, DTE, MAA, APD, SWK, GL, CMS, EIX, AEE, NUE, AOS, ROK, ESS, JBHT, TER, ED, AVY, VMC, PPG, INCY, IEX, CMI, CHD, ROP","TTWO, ADM, COO, EMN, PNW, FDS, SJM, AFL, BXP, BAX, CINF, HBAN, POOL, DHI, MHK, LNC, RHI, BRO, HOLX, ROL, ATO, STT, NTRS, SNA, FE"
2009-12,"NUE, INCY, FE, VMC, ROL, ROK, DTE, ATO, LNC, BAX, AEE, ED, POOL, SWK, NTRS, DHI, STT, FRT, SJM, IEX, ESS, PNW, MAA, AOS, TER","RHI, CINF, CHD, CMI, DOV, EIX, ADM, SNA, MHK, COO, CMS, JBHT, AFL, BRO, GL, ROP, HOLX, EMN, BXP, FDS, HBAN, AVY, APD, TTWO, PPG"
2010-01,"DHI, AFL, HBAN, HOLX, DOV, ROK, GL, CINF, ROL, INCY, RHI, PPG, SWK, IEX, TTWO, COO, AEE, FE, ATO, APD, EMN, JBHT, ROP, FDS, ADM","FRT, POOL, ED, ESS, EIX, SNA, CMS, NTRS, MAA, SJM, BXP, DTE, PNW, BRO, VMC, MHK, TER, NUE, AVY, AOS, CMI, STT, BAX, LNC, CHD"
2010-02,"POOL, ROL, ESS, FRT, TER, AOS, DOV, NTRS, EMN, FDS, PPG, DHI, STT, BXP, GL, TTWO, RHI, DTE, SNA, PNW, CMI, MHK, LNC, AFL, JBHT","HOLX, COO, MAA, ROK, SWK, CHD, ROP, IEX, CINF, NUE, CMS, HBAN, APD, BRO, AEE, AVY, ED, EIX, ADM, FE, VMC, BAX, SJM, ATO, INCY"
